Title,Category
reliance jiogigafiber could finally launch august report,Product Launch
intellivate capital advisors ltd shareholding period ended june,General
bhageria industries ltd shareholding period ended july,General
bombay rayon fashions ltd shareholding period ended june,General
air india plans bring grounded aircraft back operation oct end lohani,General
maruti ertiga xl name patented nexa ertiga launch soon,Product Launch
tdp mlas misuse assembly session ambati rambabu tv video,General
unfinished amrapali projects completed national buildings construction corporation sc,Development
nse exclude stocks sept,General
auditors india dhfl raise red flags around quarterly results,Earnings
va tech wabag bags order worth rs cr namami gange stock,Contracts
viral acharya ends rbi stint sense unfinished business business standard,Regulatory
market live nifty around sensex k hdfc twins continue fall moneycontrol com,General
kuehne nagel h profit net turnover rises quick facts,Earnings
standard chartered plc lon stan receives gbx average pt brokerages sundance herald,Ratings
mca seeks info indigo gangwal complaint,General
sc orders status quo nclat verdict essar steel insolvency case,Legal
radiology partners secures investment starr investment holdings,General
korea forced labor victims proceed sell mitsubishi assets,Business Transactions
sensex nifty flat infosys gains hdfc twins fall,General
flipkart revamps onboarding process first time sellers,General
vodafone idea offers subscribers exclusive access zee theatre,Subscribers
japan connect mizuho nomura bankroll agarwal bn buyback treble oyo stake,Share buyback
mitsui chemicals econykol biomass plastic raw material adopted use zmp new self driving car robocar walk,General
cases withdrawals epf accounts tax free,General
peoples bancorp north carolina launches pb insurance agency,Product Launch
investindustrial affiliate submits bid stake aston martin,M & A
reliance communications lenders seek rs crore ericsson claiming violation ibc,Legal
sources leaked documents reveal huawei partnered chinese state owned firm help build maintain north korean commercial wireless network washington post,Partnerships
reliance retail outperforms aided telecom fuel sales,General
markets live sensex flat nifty yes bank drops economic times,General
jammu kashmir brothers rifleman aurangzeb killed militants join territorial army indian express,General
sis group schools wins financial times international finance corporation world bank transformational business award education knowledge skills category,General
iit tirupati invites online applications engineers technicians various posts salary rs iit tirupati notified requirement candidates various staff positions several vacancies engineers technicians,General
damodar industries ltd compliances certificate reg sebi dp regulations,Regulatory
saudi aramco hold first investor call august,General
mahindra electric chief technology officer steven woolley quits,Alternative Energy
sbi net banking yono app services interrupted,Earnings
west bengal smoke seen rising bsnl building salt lake city live breaking news headlines updates july,General
new whatsapp global head meet rbi npci officials,Regulatory
posco sees global steel demand slowing year commodity comment,General
maine water seeks million bond million saco river treatment plant,General
alembic pharmaceuticals ltd announcement regulation lodr press release media release,Press Release
jammu kashmir bank ltd board meeting intimation consideration reviewed financial results bank quarter ended  june,Earnings
shiva texyarn ltd announcement regulation lodr newspaper publication,General
kotak mahindra bank q1 net profit rises lower provisions,Earnings
private hire drivers caught hacking grab gojek apps,Security
blue star bags order worth rs cr mumbai metro rail,Contracts
share market update telecom shares fall aksh optifibre slumps,General
tm gains positive technical outlook,Earnings
huawei u research arm laying workers,Layoffs
bhartiya international limited financial results,Earnings
tvs motor hits two year low weak q results,Earnings
l q preview healthy revenue growth likely aided strong execution,Earnings
bitcoin trading indicators look bullish following recent correction,Cryptocurrency
gold prices slip dollar strength profit taking,General
crypto market bitcoin showing bearish signs bch eos trx ada analysis,Cryptocurrency
bitcoin litecoin ripple xrp price prediction analysis july rd btc ltc xrp,Cryptocurrency
eur usd falls one month low dollar extends gains,Currency Movement
usd jpy inches higher buyers look establish near term control,General
bitcoin economist saifedean ammous cryptocurrencies zero sum game,Cryptocurrency
rbnz says work unconventional policy early stage,Central Banks
facts ethereum know,General
boj closely examining heightened global uncertainties says kuroda,Central Banks
markets tank fund outflows rbi caution weak q1 earnings,Central Banks
forexlive asia fx news wrap usd net higher session,General
easing hopes prop global stocks pound sags britain eyes new pm,General
rba kent aud might higher without recent rba rate cuts,Central Banks
indonesian rupiah philippine peso weaken,General
litecoin ltc usd litecoin price crash near halving could precede time highs soon,Forecast
pboc injects nearly bn yuan market one year tmlf,Central Banks
pboc said conducting targeted mlf today,Central Banks
rba says banks hold bonds meet liquidity requirement,Central Banks
pboc sets usd cny reference rate today vs yesterday,Central Banks
anz rbnz qe news help take bit heat nzd,Central Banks
bitcoin may drop fills cme btc futures gap,Forecast
bullish bitcoin trump turns pressure federal reserve cut interest rates,Economic Indicators
speech rba kent full text outlook economy monetary policy,Central Banks
cad impacted weaker external domestic environments,General
bitcoin computing power surpasses time high,Cryptocurrency
physically settled bitcoin futures horizon bakkt begins user testing,General
generational shift drive trillions dollars bitcoin says grayscale,General
blackrock says ecb boost growth across europe buying stocks,Central Banks
usd cad canadian dollar lower wholesales data disappointment,General
analyst bakkt could huge catalyst bitcoin price surge inbound,Product Pricing
ethereum,Cryptocurrency
ethereum price analysis ethusd decline,Cryptocurrency
boj governor kuroda spoke us monday pretty much usual,Central Banks
domain name registrar encirca starts pre registrations ethereum addresses,General
merkel bloc boosts support akk defense move poll shows,General
ethereum community responds eip funding proposal,General
survey four percent us public favour bitcoin crypto assets year investment,General
ethereum co founder joseph lubin taken court million failed consensys spinout token foundry,General
hartman says fed triple mandate podcast,Central Banks
honestnode founder discusses first stablecoin built bitcoin cash,General
crypto analyst spots bad sign bitcoin bulls bitcoin ethereum xrp litecoin bitcoin cash stellar eos tron forecasts,General
bitcoin maximalists vs altcoins crypto war time,General
bakkt bitcoin futures test starts today launch imminent quarter,General
fed holding back u economy harvard furman says,Central Banks
billionaire investor tim draper calls libra bridge bitcoin adoption,General
tron dapps volume reaches new record surpassing ethereum eos,General
forexlive americas fx news wrap cad grinds lower eur chf tests,General
audusd price pulled back retest demand level,General
meth trade asia alone equals half bitcoin total market cap,General
dollar euro flat traders await fed ecb rate decisions,Central Banks
bitcoin slips talk india ban,Cryptocurrency
bitcoin hard fork ytd still looks bullish,Cryptocurrency
elizabeth warren accidentally made case bitcoin,Cryptocurrency
bitcoin btc bulls unconvincing billion lost hackers,Cryptocurrency
bitcoin btc back momentum k way,Cryptocurrency
carney best candidate head imf boe predecessor king says,Central Banks
myth busted researchers say bitcoin halving affect price,General
dead eur usd trading today,General
monero xmr capped despite szabo advocacy,General
bitcoin btc begins trading sideways daily trading volume drops bulls losing momentum,General
dollar us stocks post modest gains ahead big week data earnings ecb,Central Banks
aud usd rally looks tired likely coming days ing,General
badly u crypto crackdown hurt bitcoin,General
precious metals rally gold bugs secretly holding bitcoin,General
boj kuroda says monitoring heightened global uncertainties,Central Banks
trump fed pick judy shelton says favor half point rate cut,Central Banks
iran recognizes bitcoin crypto official industry says mp,General
bitcoin may soon break bear hold weeks downtime,General
bitcoin dominance makes new peak signaling altseason could soon underway,General
audio recap pound canadian dollar stand monday,General
rupee slips paise vs usd early trade,General
proposed million ethereum funding idea sparks controversy,General
germany central bank gov ts neutral fb libra,General
bitcoin mining hotspot iran drafts electricity tariffs crypto miners,General
south african rand firmer carry trade trumps political wrangling,General
pound turkish lira gbp try exchange rate rises us imposed sanctions weigh turkish economy,Economic Indicators
fears uk slipped recession leaves euro pound sterling eur gbp exchange rate muted,General
skyrocketing price bitcoin plummets,General
libra fallout continues bitcoin finds support technicals,General
increased tensions italy league star movement leaves pound sterling euro gbp eur exchange rate flat,Geopolitical
bitcoin price analysis btcusd likely retest level,General
stocktake buy gold says founder world biggest hedge fund,Fund Activity
religare jindal steel power among companies misused india dtaa pact mauritius save taxes report,General
jingye pulls running buy british steel,General
alumina price china drops rmb aluminium ingot drops across market,General
steel dynamics chooses texas new flat rolled mill,General
gold prices fall central banks decision focus,Economic Indicators
europe stocks gain oil jumps middle east tensions,Geopolitical
theta gold mines attracts million progress open cut gold project south africa,General
gold rates rs per tola,General
new fortress tries advance delaware river terminal lng made marcellus basin,General
bhp issues world first lng fuelled freight tender ship iron ore,General
u ethanol plants expected cut output,Production
iran oil exports fell b june state department hook,Import/Export
freeport lng gets go ahead flow gas first train commissioning,General
hyssop oil emerging markets analysis regional demand growth forecast ketchum keystone,Demand
gang six pulled wool eyes banks busted fraudsters got rs crore gold loans mortgaging imitation jewellery,General
india june oil output falls lowest four months,Production
two additional effective insecticides available use soybean aphid,Crop Disease
norway natural gas liquid market industry size product application forecast,Forecast
old harbour power plant firmly roots jamaica liquefied natural gas industry,General
osaka gas japan bank international cooperation invest asian lng expansion,General
turkish refinery turns russia oil,General
base metals auris jumps pc joint venture earn,Partnerships
government extends tax break oil rigs despite promise subsidise fossil fuel industry,Production
iran oil tanker crisis mike pompeo says responsibility falls uk take care ships,General
black hills customers may see monthly bill increases casper wy oil city news,General
hurricane barry impact still felt usgc crude market platts data,General
alaysian palm oil price gains stronger overnight u soyoil,General
gold edges marginally moving sideways,General
blackham resources ltd asx blk sells lake way tenements retains gold mining rights,General
millions barrels iranian oil piled china ports,General
oil rises iran seizes british tanker,General
u sanctions chinese company chief executive importing iranian oil,Import/Export
oil prices reflecting severity iran crisis tensions escalate strait hormuz analyst,Geopolitical
business maverick analysis oil murky waters geopolitical tensions mount,Geopolitical
judge rules oil companies keep climate liability case rhode island,Legal
russia data june fuel oil exports year mil mt,Import/Export
gold uptren continue target,General
mars crude climbs four month high storm related output losses,Production
brazilian soybean crop shows decreased protein content,General
usda crop progress corn quality slips soybeans steady,General
working natural gas stocks half full regions deficit five year average declines,Market Supply
president sends letter natural gas proposal unsg eu officials c leader,General
steel dynamics announces planned new flat roll steel mill site selection,General
hotter forecast trends help natural gas futures rebound cash stronger west,Forecast
south koreas kocopia buys tonnes corn recorder,General
corn soybean condition ratings improve usda crop progress report says,General
gold holds steady investors await fed rate cut decision,Economic Indicators
china taiyuan coal transaction price index pct,General
china iron ore falls port stocks hit month high,General
dhfl expects approval resolution plan lenders month end,General
average monthly job creation month high epfo data,General
share market update metal shares decline welspun corp falls,General
maruti suzuki xl leaked launch st august,Product Launch
rio tinto mongolia copper problems highlight frontier country risks russell,General
malaysia epf invests australian healthcare real estate fund,General
iit kharagpur students develop ai app elderly care,General
iit guwahati plans extension centers north eastern states,General
bayer sells dr scholl foot care business boston firm,Restructuring
whatsapp available kaios feature phones,General
axis bank allots equity shares rs,Capital Market
indigo scrip rises board expansion plans,Expansion
bombay hc allows ratan tata plea quash defamation suit lower court,Legal
hyundai motor india organizes mega experience service camp,General
trai may take call rs cr fine airtel voda idea july,Regulatory
ntt data becomes google cloud premier partner,General
bigg boss telugu creates world wide record first day tv video,General
coromandel international ltd q consolidated pat falls rs crores,Earnings
big relief air travellers dholera international airport project cleared take,General
blue star ltd announcement regulation lodr newspaper publication,General
like nlc india limited nse nlcindia p e ratio,General
lpl financial welcomes charton financial group,General
diana shipping extends kamsarmax charter cargill,General
kei industries gets reaffirmation credit ratings icra,Ratings
sensex tanks pts hdfc twins sink,General
acb exposes j k bank insurance scam fir registered,General
fin homes ltd reports jump net profit rs crores q fy,Earnings
buy acc target rs hdfc securities,Ratings
goair launch international flights vietnam cambodia bhutan,Product Launch
goair launches new flights mumbai delhi abu dhabi international airport,Product Launch
bandhan bank appoints sbi sanjeev naryani head business,Management Change
wework built economic optimism dangerous thing,General
l q results tuesday expect,Earnings
tanla solutions ltd board meeting intimation unaudited financial results company quarter three months ended june,Earnings
nhb asks housing finance companies desist financing subvention schemes,General
tvs motor company limited outcome board meeting,General
lic policy get guaranteed return rs lakh rs lakh pay rs rs premium jeevan aadhaar plan tax benefit available,General
reliance retail starts assisted e commerce ajio jio stores,General
bakkt set commence user testing bitcoin futures july,Expansion
pound sterling us dollar exchange rate recovery fades brexit fed bets dominate outlooks,Central Banks
bitcoin billionaires author write crypto showtime hit drama billions,General
ethereum eth remains extremely vulnerable bears cusp gaining control,General
forex sterling falls countdown new uk pm begins,General
sterling dives markets ramp bets deal brexit,General
mexican bitcoin exchange bitso gets gibraltar dlt license,General
boj kuroda economy finally longer deflation,Central Banks
popularity bitcoin crypto scams south korea,General
usd cad climbs friday high,General
u dollar falls fed rate cut likely month,Central Banks
dollar euro hold steady ahead ecb meeting,Central Banks
euro us dollar eur usd exchange rate steadies chicago activity index falls forecasts,General
indian police seize million bitcoin sh ty bitconnect scammers,General
survey suggests people know libra ethereum xrp,General
lamassu bitcoin atm software gets major update includes segwit support,General
indian bitcoin gov releases report ban crypto details,General
binance coin rollercoaster continues bnb records moderate gains btc altcoins continue consolidating,General
steve shadders bitcoin quasar upgrade return power miners,General
could bitcoin dominance help btc based projects pull ahead competition,General
bitcoin fast approaching halving leads aggressive surge prices follow surge,General
bitcoin btc runs strong resistance downside expected,General
china impose anti dumping tax stainless steel indonesia eu japan south korea,Govt. Policies
u natural gas prices sinking,General
cnooc adnoc sign mou exploration oil refining lng trade state media,Production
lng developer move stock listing u australia,Market Supply
silver closes month high gold ekes gain,General
u livestock cattle futures rally corn futures slump,General
gold silver price manipulation greatest trick ever pulled,General
oil futures pare gains outlook,General
freeport lng train reaches final commissioning stage,General
gold edges traders stay hopeful rate cuts amid central banks blackout,Economic Indicators
silver finally playing catch gold,General
nucor arcelormittal flat rolled steel prices,General
usda crop progress us cotton squaring percent setting bolls percent,General
semis soar small caps sink silver surges,General
philadelphia energy solutions files bankruptcy refinery fire,Disruption
gold next rally see levels end says abn amro,General
crude futures rise traders watch geopolitical tensions brent wti,Geopolitical
us shale doomed matter,General
eni starts works floating liquefied natural gas unit hull offshore mozambique,Expansion
gold price soars rs traded rs per tola,General
tellingly gold hesitates making new high,General
nearby cotton futures end positive ground,General
bunge bp team brazil sugar ethanol venture,Partnerships
tango mining reports carats diamond sales average usd per carat oena diamond mine south africa,Earnings
tango reports carats diamond sales average usd per carat oena diamond mine south africa,Earnings
analysis us jet fuel premium diesel gasoil poised persist winter,General
china steel mill boss detained pollution offences state media,General
european stocks tread water oil gains gulf standoff,General
arcelormittal ups flat rolled steel prices,General
oil majors lift ftse ted baker surges chatter,M & A
stanchart ceo blasts investors immature pay,Remuneration
rio tinto completes sale stake r ssing uranium limited,Business Transactions
goldman sachs lendable reach deal loans,General
bayer roundup award slashed million million,General
uber lyft ride totals new york city slow fares increase,General
hdfc bank ltd hdb stock rose shareholder aviva plc increased stake epr pptys epr share value rose honeywell international cut stake investreporter,Business Transactions
adani port likely raise million via bond sales,Debt
leading global airport operator manage new billion terminal one newark liberty,General
spacex astronaut mission looking increasingly difficult executive,General
jpmorgan shakes team push private deals,Partnerships
jaguar land rover offered loan develop electric cars,Alternative Energy
il fs eyes rs cr sale two towers gift city,General
flipkart begun incentivising sellers offer discounts flipkart plus customers,Promotions
flaws whatsapp telegram allow hackers alter files,Security
indiabulls housing finance limited updates,General
cargill ecolab accelerate food industry innovation second year techstars farm fork accelerator,General
repco mfi wins award nabard shg linkage tn,General
mahindra logistics limited analysts institutional investor meet con call updates,General
tata metaliks q1 pat rs cr,Earnings
tata valuable indian brand lic infosys sbi next,General
adani enterprises ltd announcement regulation lodr meeting updates,General
housing development finance corporation ltd compliances reg details loss certificate duplicate certificate,General
rbi slaps rs cr penalty sbi violating various norms,Regulatory
rebel mlas mumbai may skip trust vote july tv video,General
dhfl plunges week low company survival concerns,Capital Market
icici bank ltd compliances reg details loss certificate duplicate certificate,General
power outage dubai airport leaves passengers sweating,Disruption
dmrc begins trial run dwarka najafgarh metro corridor open september,Expansion
cipla ltd announcement regulation lodr acquisition,M & A
vistara goair air india new international flights check ticket fares discounts,Promotions
amazon prime day sale best deals apple iphones hindustan times,General
gowra leasing finance ltd compliances certificate reg sebi dp regulations,Regulatory
united van der horst ltd clarification sought united van der horst ltd,General
universal prime aluminium ltd outcome board meeting,General
dosti realty brings homes furnished ikea project dosti west county,General
swarnsarita gems ltd clarification sought swarnsarita gems ltd,General
indo rama synthetics india ltd disclosures reg sebi sast regulations,Regulatory
aster dm healthcare limited updates,General
modella woollens ltd clarification sought modella woollens ltd,General
artefact projects ltd clarification sought artefact projects ltd,General
gsk vodafone among companies fighting eu tax clawback order,Tax
ingram micro announces first global competition find next revolutionary startups,General
boehringer ingelheim acquires amal therapeutics significantly enriching cancer immunology portfolio novel cancer vaccines platform,M & A
kelsey camille grammer former home hits market,General
philadelphia refinery saved,General
senbo industries ltd disclosures reg respect acquisition reg sebi sast regulations,Regulatory
indusind bank ltd compliances reg details loss certificate duplicate certificate,General
california inc black market wildlife thrives facebook instagram,General
nse india vix declines  straight session,General
indigo secures credit facility worth crore amidst promoters dispute,Fund Raising
huawei announces availability huawei watch gt active india exclusively flipkart,Product Launch
dentsu aegis network takes majority stake ugam,Business Transactions
amul celebrates england icc cricket world cup victory utterly delicious topical,General
crypto analyst bitcoin stock flow predicts leading crypto shatter million btc ethereum xrp litecoin forecasts,Forecast
ron paul pledges allegiance bitcoin calls crypto great idea,General
us treasury secretary slams bitcoin crypto libra national security issue,General
vitalik buterin weighs bitcoin cash vs ethereum network scalability,General
bitcoin tumbles k mark crypto market turns bearish,General
trump power ban bitcoin really,General
euro us dollar eur usd exchange rate flat empire state manufacturing index largest turnaround two years,General
ethereum price analysis eth marked current daily low recover,General
pound south african rand exchange rate news gbp zar nosedives following chinese data dump,General
vitalik buterin proposes using bitcoin cash data layer ethereum,General
euro pound sterling eur gbp exchange rate improves uk house prices figures fall,General
bitcoin btc price could fall lower analysts say bears waking,General
ethereum price analysis bulls respond eth usd decrease,General
pound declines month low franc,General
nz dollar extends gain strong china data,General
cable slips session low pound holds slightly softer,General
new zealand inflation remains central bank target midpoint,Inflation
pboc sets usd cny mid point today vs yesterday,Central Banks
nzd barely changed tics wake q cpi data,Inflation
bitcoin cash multi party escrow retail adoption upgrade discussions,General
usd cad canadian dollar lower lower oil chinese mixed data,General
analysts believe bitcoin looks bullish despite growing fears trump ban,Regulatory
monero reports resolving fake xmr minting bugs month fix,General
audusd trending upwards targeting,General
case crypto market rebound bitcoin price rise sharp drop,General
bitcoin price watch trump could push currency,General
donate bitcoin protect internet privacy new tor project crowdfund,General
dollar edges higher recent losses,General
bitcoin technology tremendous value says vanguard davis,General
boj would back government stimulus october ex official says,Regulatory
three men india held beaten bitcoin,Cryptocurrency
fundstrat tom lee bitcoin pullback healthy fewer searches good,Cryptocurrency
bitcoin supported payment firm uphold expands presence portugal,Cryptocurrency
bitcoin lightning nodes claimed btc justice thieves bitmex,Cryptocurrency
bitcoin tumbles gold steady china data shows growth,Cryptocurrency
bitcoin exchange bitebtc reopens fedlio return frozen user funds,Cryptocurrency
