Title,Category
us treasury secretary bitcoin national security issue cryptocurrency dominated illicit activity speculation,Security
dollar modestly higher thin summer trading upside limited,General
altcoin markets successfully bucking bearish trend,General
economic calendar asia today nz inflation rba,Inflation
bitcoin price surged mnuchin made crucial remark,Cryptocurrency
eur usd diverge oil baml,General
ubs sees room downside eur aud,General
stock market gains near month high foreign inflows surge rupee slips,General
set protocol launches ethereum trading strategy bots,General
products buy dollar general skip every time,General
ethereum eth shows severe selling pressure amid bearish sentiments,Cryptocurrency
libra bitcoin friends enemies frenemies,Cryptocurrency
winning jackpot numbers game cryptoslots live bitcoin news,General
euro zone bond yields inch italy outperforms,Currency Movement
lightning network justice stern enough thefts occur bitcoin nd layer solution,General
bitcoin cliff hanger btc slides early stage correction,Cryptocurrency
xtra bitcoin inc xtra bitcoin inc tcel fka therapy cells inc,Cryptocurrency
recent drop ethereum xrp litecoin due rebound,Cryptocurrency
citi kicks earnings season oil softens barry impact gold steady bitcoin pares losses post mnuchin,Earnings
eur usd rally,General
weekly chart bitcoin dazed john mcafee remains unfazed,General
scotiabank turns dollar market first green bond,General
fed policy creating greatest bubble history ex budget director stockman says,Central Banks
regain privacy bitcoin btc bitcoinmix org,General
fundstrat bitcoin fall healthy eoy possible,General
crypto trader predicts nearing alt season bitcoin dominance weakens,Cryptocurrency
buterin proposes bitcoin cash integration scale ethereum short term,Cryptocurrency
flash crashing analysts expect ethereum continue dropping,General
singapore become bitcoin capital world,General
trump tweets bitcoin tether accidentally prints bn usdt,Cryptocurrency
bitcoin cme futures take hit value drop justin sun lists future plans tron,General
trump banning bitcoin feasible highly unlikely says economist,General
ethereum basic principles trading,Cryptocurrency
ethereum collateralized dai resuscitate collapse,Cryptocurrency
amidst crypto market crashing john mcafee speaks mln bitcoin bet,General
windows xp available bitcoin sv blockchain,Cryptocurrency
ethereum eth momentum turns bearish major bear flag remains intact,Cryptocurrency
cardano ada struggles hold support bears keep pushing feasible near term,General
audio recap pound weighed otherwise slow start week,General
bitcoin dominance continues rise dashing hopes altseason,Cryptocurrency
eur usd trading strategies,Currency Movement
bitcoin btc plunges regulatory hurdles analysts project downside,Cryptocurrency
bitcoin based thin air usd fiat,General
mexican fuel marketers confident offer ethanol following tour iowa ethanol supply chain,Market Supply
corn ethanol report,General
nlmk usa sells less steel output q,Production
fulcrum energy capital funds announces formation eagle ford operator pachira oil gas,General
pakistan cotton crop progressing reasonably well,General
dundee precious metals announces preliminary economic assessment timok gold project serbia,General
mcdermott wins feed contract sohar lng bunkering project oman,Contracts
precious metals gold silver futures upbeat domestic cues,General
oil prices hold gains chinese data,General
graphic european gas prices exceed asian spot lng shuts arbitrage,Supply Disruptions
trump sign order u content thresholds steel iron navarro,General
exclusive india keep sugar export subsidies even rivals complain sources,Govt. Policies
trump increase buy american steel content requirements,General
july scrap gold silver platinum prices soared index,General
chevron seeks turn canada lng plan electric design,General
usda crop progress corn soybean conditions improve,General
rural natural gas pipeline expansion start month,Expansion
vision enbridge team promote cng trucks,Partnerships
cropenergies ethanol production operating profit q,Production
pacific ethanol temporarily defers loan payment,General
governor newsom orders firing top oil regulator fracking increases,General
shale investors fear bloodbath earnings season kicks,General
halls university nebraska alumni debra powell corn nation,General
funds remain short canola soybeans,General
total presses ahead middle east lng bunkering hub plans,General
u grains corn pulls back five year high,General
platinum group metals ltd reports third quarter results provides waterberg palladium project update,Earnings
cs kiunjuri grain reserve boss touch reality maize,General
corn based plastics next ethanol,General
argentinian crude steel production increases percent june,Production
soybean corn tissue testing aid managing hidden hunger,General
gold prices settle nearly two week peak,General
brazil considers reinstating ethanol import tariff,Govt. Policies
oil sees short term gains lower us crude oil inventories,Market Supply
dirty energy rides natural gas surge even carbon limits bite,General
abadi lng gets greenlight revised plan development,General
bhp looks lng lower iron ore shipping emissions,General
tata steel india records growth q fy production,Production
tsingshan indonesia shakes stainless steel markets south east asia,General
corn jumps hit year high forecast stokes supply woes,Forecast
china copper prices rebound us relaxes huawei ban trade tension eases,Geopolitical
china steel output rise pc year june,Production
china iron ore coke rise demand outlook steel rebounds,Demand
rice corn soybeans wheat cotton fundamentals show big supplies,Market Supply
venezuela defies sanctions sell million gold reserves,General
gold fairly steady final week window fed cut,Economic Indicators
mcx aluminium may trade levels,General
mcx mentha oil fresh buying resistance seen,General
china lng imports spark security debate,Import/Export
chevron aims lowest emission lng plant world new electric plan,Development
russian oil companies ask bn tax breaks arctic development,Tax
middle east crude benchmarks fall sokol basra premiums rise,General
eia forecasts u shale oil output climb barrels day august,Production
energy transfer announces binding supplemental open season bakken pipeline system,General
realme go sale first time india tomorrow via flipkart realme website price sale offers specifications,General
paytm ties clix finance offer instant short term loans,Partnerships
rana kapoor morgan credits pledge yes bank shares worth rs crore,General
former rio tinto adviser became mining big short,General
liquidity serious issue fpis taxes surcharges raj bhatt elara capital,General
sbi web based banking services restored many hours,General
indiabulls housing finance may invest rs crore lvb,Corporate Growth
hul may buck slowdown stock still top fmcg play,General
buy vedanta target rs kunal bothra,Ratings
boris johnson set become next u k pm hindu,General
stocks watch tvs motor co hul yes bank usl l zeel dhfl indigo,General
eps growth european eltech mcx eelt interesting,Estimates
reskill survive tech firms retrain staff war footing,General
